ISBN,abstract,address,archivePrefix,authors,booktitle,doi,eprint,highlight,issn,journal,month,note,number,organization,pages,primaryClass,publisher,school,title,volume,year,url
,,,,"Lorenzo, Ferrone; Zanzotto, Fabio Massimo; Carreras, Xavier",,,,,,,,,,,,,,,Decoding Distributed Tree Structures,,-,
,,,,"Fanciulli, Francesca; Massetani, Maria; Raffaelli, Remo; Basili, Roberto; Pazienza, Maria Teresa; Saracino, Dario; Zanzotto, Fabio; Mana, Nadia; Pianesi, Fabio",,,,,,,,,,,,,,,BUILDING THE ITALIAN SYNTACTIC-SEMANTIC TREEBANK,,-,
,,,,"Bosco, Cristina; Tonelli, Sara; Zanzotto, Fabio Massimo",,,,,,,,,,,,,,,La scrittura in emoji tra dizionario e traduzione,,-,
,,,,"Bosco, Cristina; Tonelli, Sara; Zanzotto, Fabio Massimo",,,,,,,,,,,,,,,Costituzione di un corpus giuridico parallelo italiano-arabo,,-,
,,,,"Basili, Roberto; Pazienza, Maria Teresa; Zanzotto, Fabio Massimo",,,,,,,,,,,,,,,Ontology Mapping: a survey and a proposal.,,-,
,,,,"Basili, Roberto; Pazienza, Maria Teresa; Saracino, Dario; Zanzotto, Fabio Massimo",,,,,,,,,,,,,,,GesTALt: the Italian Syntactic-Semantic Treebank annotation tool,,-,
